{
  "id": "0192cae6-0002-7000-8000-000000000000",
  "version": "1.0.0",
  "name": "audit-harness-escape-scan-spec",
  "description": "Validates escape-scan rejects all known escape patterns",
  "matchers": ["0192cae6-0003-7000-8000-000000000000"],
  "assertions": [],
  "scoring": { "aggregation_rule": "majority" },
  "composition": {
    "nodes": [{ "id": "root", "kind": "eval_run", "ref": "0192cae6-0004-7000-8000-000000000000" }],
    "edges": []
  },
  "expected_artifacts": ["d4d4d4d4d4d4d4d4d4d4d4d4d4d4d4d4d4d4d4d4d4d4d4d4d4d4d4d4d4d4d4d4"],
  "runtime_limits": {
    "token_ceiling": 100000,
    "wall_clock_ceiling_ms": 60000,
    "memory_ceiling_mb": 512,
    "concurrency_hint": 1
  },
  "provider_constraints": ["anthropic"],
  "created_at": "2026-05-17T00:00:00Z",
  "created_by": "jeremy@intentsolutions.io",
  "content_hash": "e5e5e5e5e5e5e5e5e5e5e5e5e5e5e5e5e5e5e5e5e5e5e5e5e5e5e5e5e5e5e5e5"
}
